{
  "schemaVersion": 1,
  "id": "prod-do-hal-0008",
  "sku": "DO-HAL-0008",
  "title": "Haunted House Ghost Story PNG Bundle, Creepy Mansion Designs (Digital Download)",
  "slug": "haunted-house-ghost-story-png-bundle-creepy-mansion-designs-digital-download",
  "description": "A classic ghost-story quartet: a pale hand reaching from an old stone well deep in the woods, a ghostly face watching from a weathered attic window, a black cat perched on a bone throne of skulls, and a spectral woman reflected in an antique mirror.\n\n✦ WHAT YOU GET\n• 4 separate high-resolution PNG files (2400 x 2400 px, 300 DPI)\n• Ready for sublimation coasters, UV DTF printing, tumblers, and more\n• Instant digital download — no physical item is shipped\n\n✦ DESIGN NOTES\nEerie interiors and quiet dread run through all four scenes, making this a great pick for classic haunted-house and ghost-story fans.\n\n✦ AI DISCLOSURE\nThese designs were created with the assistance of AI image-generation tools as part of my creative process, then hand-curated, cleaned up, and prepared for print. This listing is a digital file only; no physical product is shipped.\n\n✦ USAGE\nFor personal use and small-batch commercial use on physical items you make and sell (coasters, tumblers, apparel, etc.). Resale or redistribution of the digital files themselves is not permitted.\n\nThank you for shopping Dragon Oak Studio!",
  "collection": "halloween",
  "subcollection": "coaster-bundles",
  "productType": "digital_download",
  "tags": [
    "haunted_house_png",
    "ghost_coaster_art",
    "creepy_mansion",
    "haunted_mirror",
    "skull_throne_png",
    "coaster_sublimation",
    "uv_printer_file",
    "halloween_coaster",
    "spooky_clipart",
    "black_cat_png",
    "digital_download",
    "png_bundle",
    "instant_download"
  ],
  "price": {
    "amountCents": 399,
    "currency": "USD"
  },
  "images": [
    {
      "path": "https://i.etsystatic.com/64473522/r/il/43678c/8592973735/il_fullxfull.8592973735_72y4.jpg",
      "alt": "Haunted House Ghost Story PNG Bundle, Creepy Mansion Designs (Digital Download)"
    },
    {
      "path": "https://i.etsystatic.com/64473522/r/il/930208/8545106808/il_fullxfull.8545106808_l3pk.jpg",
      "alt": "Haunted House Ghost Story PNG Bundle, Creepy Mansion Designs (Digital Download)"
    },
    {
      "path": "https://i.etsystatic.com/64473522/r/il/320db6/8592973785/il_fullxfull.8592973785_8xau.jpg",
      "alt": "Haunted House Ghost Story PNG Bundle, Creepy Mansion Designs (Digital Download)"
    },
    {
      "path": "https://i.etsystatic.com/64473522/r/il/1c62ab/8545106988/il_fullxfull.8545106988_q6cg.jpg",
      "alt": "Haunted House Ghost Story PNG Bundle, Creepy Mansion Designs (Digital Download)"
    },
    {
      "path": "https://i.etsystatic.com/64473522/r/il/c1cec3/8592973791/il_fullxfull.8592973791_5guq.jpg",
      "alt": "Haunted House Ghost Story PNG Bundle, Creepy Mansion Designs (Digital Download)"
    }
  ],
  "digitalFiles": [],
  "etsy": {
    "listingId": null,
    "url": null,
    "state": "not_listed",
    "syncedAt": null
  },
  "siteState": "published",
  "featured": false,
  "createdAt": "2026-09-21T12:00:00Z",
  "updatedAt": "2026-09-21T12:00:00Z",
  "provenance": "Imported from EtsyListingsDownload.csv for Storefront V1; CSV does not include reliable Etsy listing IDs or product URLs."
}
