{
  "schemaVersion": 1,
  "id": "prod-do-hal-0013",
  "sku": "DO-HAL-0013",
  "title": "Zombie Graveyard Carnival Coaster Bundle, 4 Halloween Horror PNGs (Digital Download)",
  "slug": "zombie-graveyard-carnival-coaster-bundle-4-halloween-horror-pngs-digital-downloa",
  "description": "A restless-dead quartet mixing classic graveyard horror with haunted carnival thrills: a decayed hand bursting up through the earth, a skeletal horse-drawn hearse rolling past the crypt, an abandoned moonlit carousel and Ferris wheel, and a scarecrow standing guard in the cornfield with a lit jack-o'-lantern at its feet.\n\n✦ WHAT YOU GET\n• 4 separate high-resolution PNG files (2400 x 2400 px, 300 DPI)\n• Ready for sublimation coasters, UV DTF printing, tumblers, and more\n• Instant digital download — no physical item is shipped\n\n✦ DESIGN NOTES\nFrom the graveyard to the fairground, this set pairs rising-dead horror with classic haunted-attraction imagery.\n\n✦ AI DISCLOSURE\nThese designs were created with the assistance of AI image-generation tools as part of my creative process, then hand-curated, cleaned up, and prepared for print. This listing is a digital file only; no physical product is shipped.\n\n✦ USAGE\nFor personal use and small-batch commercial use on physical items you make and sell (coasters, tumblers, apparel, etc.). Resale or redistribution of the digital files themselves is not permitted.\n\nThank you for shopping Dragon Oak Studio!",
  "collection": "halloween",
  "subcollection": "coaster-bundles",
  "productType": "digital_download",
  "tags": [
    "zombie_hand_png",
    "haunted_carousel",
    "hearse_graveyard",
    "scarecrow_cornfield",
    "haunted_carnival",
    "coaster_sublimation",
    "uv_printer_file",
    "halloween_coaster",
    "spooky_clipart",
    "horror_night_art",
    "digital_download",
    "png_bundle",
    "instant_download"
  ],
  "price": {
    "amountCents": 399,
    "currency": "USD"
  },
  "images": [
    {
      "path": "https://i.etsystatic.com/64473522/r/il/de4a1c/8593028775/il_fullxfull.8593028775_nia6.jpg",
      "alt": "Zombie Graveyard Carnival Coaster Bundle, 4 Halloween Horror PNGs (Digital Download)"
    },
    {
      "path": "https://i.etsystatic.com/64473522/r/il/965e27/8593028873/il_fullxfull.8593028873_rwyp.jpg",
      "alt": "Zombie Graveyard Carnival Coaster Bundle, 4 Halloween Horror PNGs (Digital Download)"
    },
    {
      "path": "https://i.etsystatic.com/64473522/r/il/13ceca/8593028887/il_fullxfull.8593028887_7hjf.jpg",
      "alt": "Zombie Graveyard Carnival Coaster Bundle, 4 Halloween Horror PNGs (Digital Download)"
    },
    {
      "path": "https://i.etsystatic.com/64473522/r/il/e5150b/8593028883/il_fullxfull.8593028883_m3u3.jpg",
      "alt": "Zombie Graveyard Carnival Coaster Bundle, 4 Halloween Horror PNGs (Digital Download)"
    },
    {
      "path": "https://i.etsystatic.com/64473522/r/il/84c63a/8545161514/il_fullxfull.8545161514_6mb0.jpg",
      "alt": "Zombie Graveyard Carnival Coaster Bundle, 4 Halloween Horror PNGs (Digital Download)"
    }
  ],
  "digitalFiles": [],
  "etsy": {
    "listingId": null,
    "url": null,
    "state": "not_listed",
    "syncedAt": null
  },
  "siteState": "published",
  "featured": false,
  "createdAt": "2026-09-21T12:00:00Z",
  "updatedAt": "2026-09-21T12:00:00Z",
  "provenance": "Imported from EtsyListingsDownload.csv for Storefront V1; CSV does not include reliable Etsy listing IDs or product URLs."
}
