{
  "schemaVersion": 1,
  "id": "prod-do-bkm-0001",
  "sku": "DO-BKM-0001",
  "title": "Complete Wine Girl Magnetic Bookmark Printable Collection, 20 Designs, 2x6 Inch PNG, Wine Lover Gift, Digital Download",
  "slug": "complete-wine-girl-magnetic-bookmark-printable-collection-20-designs-2x6-inch-pn",
  "description": "The complete collection: ALL 20 wine-lover magnetic bookmark designs in one instant download, ready to print at home or at a print shop. Stylish women enjoying a glass of wine, each with a wine-themed journaling quote on the back panel. Print, cut, fold, and add magnets for bookmarks, wine journal accessories, party favors, or gifts.\n\n✦ BEST VALUE\nIncludes all four of our 5-design wine bookmark bundles: Bundle 1 (Designs 01–05), Bundle 2 (Designs 06–10), Bundle 3 (Designs 11–15), Bundle 4 (Designs 16–20). Buying the four bundles separately is $19.96; the complete 20-design collection is $12.99.\n\n✦ WHAT YOU GET\n• 20 PNG designs delivered as 5 ZIP files (4 designs per ZIP). Download all 5 ZIP files and unzip them; together they contain all 20 designs.\n• Each design: 1200 x 3600 px, 600 PPI, 2 x 6 inches flat / 2 x 3 inches folded\n• A short printing-instructions text file is included in each ZIP\n• Instant digital download, no physical item shipped\n\n✦ THE DESIGNS\nDesigns 01–20 feature a variety of wine-lover portraits and backdrops — florals, watercolors, marble, golden light, sunset skies, tropical blooms, city lights, and more. See the listing photos for every design.\n\n✦ HOW TO USE\n• Print at 100% / Actual Size (do not use \"Fit to Page\")\n• Each bookmark prints flat at 2 x 6 inches and folds to 2 x 3 inches at the center bridge\n• Cut around the bookmark outline, fold at the center, and add small magnets to the inside ends to make a magnetic bookmark (magnets, paper, and printer are not included)\n• The upside-down quote on the back panel is intentional; it reads correctly once the bookmark is folded\n\n✦ FILE DETAILS\n• Format: PNG, RGB (sRGB color)\n• Size: 1200 x 3600 px per design (2 x 6 inches at 600 PPI)\n• The artwork is supplied on a solid black (white on Design 16) background outside the bookmark outline (no transparent background) — cut along the bookmark edge\n• Original artwork files; the ZIP packaging (if any) does not compress or change the images\n\n✦ INSTANT DIGITAL DOWNLOAD\nYour files are available to download from Etsy immediately after payment is confirmed. This is a DIGITAL PRODUCT: no physical bookmark, magnets, or printed item will be shipped, and nothing is sent to you manually.\n\n✦ AI DISCLOSURE\nThese designs were created with the assistance of AI image-generation tools as part of my creative process, then hand-curated, cleaned up, and prepared for print.\n\n✦ USAGE\nFor personal use and small-batch commercial use on physical items you make and sell. Resale or redistribution of the digital files themselves is not permitted.\n\n✦ PLEASE NOTE\nPrinted colors can vary by monitor, printer, ink, and paper. Preview images carry a watermark; the files you download do not.\n\nThank you for shopping Dragon Oak Studio!",
  "collection": "cute-bookmarks",
  "subcollection": "wine-magnetic-bookmarks",
  "productType": "digital_download",
  "tags": [
    "magnetic_bookmark",
    "printable_bookmark",
    "bookmark_png",
    "wine_bookmark",
    "wine_lover_gift",
    "wine_journal",
    "wine_girl_art",
    "digital_download",
    "instant_download",
    "bookmark_bundle",
    "diy_bookmark",
    "book_lover_gift",
    "bookmark_collection"
  ],
  "price": {
    "amountCents": 1299,
    "currency": "USD"
  },
  "images": [
    {
      "path": "https://i.etsystatic.com/64473522/r/il/c34365/8549844100/il_fullxfull.8549844100_pf78.jpg",
      "alt": "Complete Wine Girl Magnetic Bookmark Printable Collection, 20 Designs, 2x6 Inch PNG, Wine Lover Gift, Digital Download"
    },
    {
      "path": "https://i.etsystatic.com/64473522/r/il/202537/8597718523/il_fullxfull.8597718523_mkxy.jpg",
      "alt": "Complete Wine Girl Magnetic Bookmark Printable Collection, 20 Designs, 2x6 Inch PNG, Wine Lover Gift, Digital Download"
    },
    {
      "path": "https://i.etsystatic.com/64473522/r/il/c5c4d6/8549844234/il_fullxfull.8549844234_fret.jpg",
      "alt": "Complete Wine Girl Magnetic Bookmark Printable Collection, 20 Designs, 2x6 Inch PNG, Wine Lover Gift, Digital Download"
    },
    {
      "path": "https://i.etsystatic.com/64473522/r/il/e3ca30/8597718635/il_fullxfull.8597718635_t509.jpg",
      "alt": "Complete Wine Girl Magnetic Bookmark Printable Collection, 20 Designs, 2x6 Inch PNG, Wine Lover Gift, Digital Download"
    },
    {
      "path": "https://i.etsystatic.com/64473522/r/il/f8e8f3/8549844386/il_fullxfull.8549844386_4y0e.jpg",
      "alt": "Complete Wine Girl Magnetic Bookmark Printable Collection, 20 Designs, 2x6 Inch PNG, Wine Lover Gift, Digital Download"
    }
  ],
  "digitalFiles": [],
  "etsy": {
    "listingId": null,
    "url": null,
    "state": "not_listed",
    "syncedAt": null
  },
  "siteState": "published",
  "featured": false,
  "createdAt": "2026-09-21T12:00:00Z",
  "updatedAt": "2026-09-21T12:00:00Z",
  "provenance": "Imported from EtsyListingsDownload.csv for Storefront V1; CSV does not include reliable Etsy listing IDs or product URLs."
}
