{
  "schemaVersion": 1,
  "id": "prod-do-hal-0005",
  "sku": "DO-HAL-0005",
  "title": "Werewolf Full Moon Coaster Bundle, Wolf Pack & Cemetery Designs (Digital Download)",
  "slug": "werewolf-full-moon-coaster-bundle-wolf-pack-and-cemetery-designs-digital-downloa",
  "description": "A wolf-themed quartet for horror lovers: a snowy cabin marked by mysterious paw prints in the moonlight, a quiet autumn cemetery watched over by a crow, a lone werewolf howling atop a cliff under a blood moon, and a wolf pack howling together beneath a giant winter moon.\n\n✦ WHAT YOU GET\n• 4 separate high-resolution PNG files (2400 x 2400 px, 300 DPI)\n• Ready for sublimation coasters, UV DTF printing, tumblers, and more\n• Instant digital download — no physical item is shipped\n\n✦ DESIGN NOTES\nFrom a single set of tracks in the snow to a full pack in full voice, this collection tells a wolf-moon story across four connected scenes.\n\n✦ AI DISCLOSURE\nThese designs were created with the assistance of AI image-generation tools as part of my creative process, then hand-curated, cleaned up, and prepared for print. This listing is a digital file only; no physical product is shipped.\n\n✦ USAGE\nFor personal use and small-batch commercial use on physical items you make and sell (coasters, tumblers, apparel, etc.). Resale or redistribution of the digital files themselves is not permitted.\n\nThank you for shopping Dragon Oak Studio!",
  "collection": "halloween",
  "subcollection": "coaster-bundles",
  "productType": "digital_download",
  "tags": [
    "werewolf_png_art",
    "wolf_pack_moon",
    "full_moon_howl",
    "cemetery_crow_png",
    "snowy_cabin_art",
    "coaster_sublimation",
    "uv_printer_file",
    "halloween_coaster",
    "spooky_clipart",
    "wolf_moon_art",
    "digital_download",
    "png_bundle",
    "instant_download"
  ],
  "price": {
    "amountCents": 399,
    "currency": "USD"
  },
  "images": [
    {
      "path": "https://i.etsystatic.com/64473522/r/il/7df9a8/8592988193/il_fullxfull.8592988193_e26u.jpg",
      "alt": "Werewolf Full Moon Coaster Bundle, Wolf Pack & Cemetery Designs (Digital Download)"
    },
    {
      "path": "https://i.etsystatic.com/64473522/r/il/2de8c2/8592988293/il_fullxfull.8592988293_4fiz.jpg",
      "alt": "Werewolf Full Moon Coaster Bundle, Wolf Pack & Cemetery Designs (Digital Download)"
    },
    {
      "path": "https://i.etsystatic.com/64473522/r/il/6c0938/8592988291/il_fullxfull.8592988291_5xy9.jpg",
      "alt": "Werewolf Full Moon Coaster Bundle, Wolf Pack & Cemetery Designs (Digital Download)"
    },
    {
      "path": "https://i.etsystatic.com/64473522/r/il/6d07ba/8592988285/il_fullxfull.8592988285_k10q.jpg",
      "alt": "Werewolf Full Moon Coaster Bundle, Wolf Pack & Cemetery Designs (Digital Download)"
    },
    {
      "path": "https://i.etsystatic.com/64473522/r/il/de6982/8592988297/il_fullxfull.8592988297_by2h.jpg",
      "alt": "Werewolf Full Moon Coaster Bundle, Wolf Pack & Cemetery Designs (Digital Download)"
    }
  ],
  "digitalFiles": [],
  "etsy": {
    "listingId": null,
    "url": null,
    "state": "not_listed",
    "syncedAt": null
  },
  "siteState": "published",
  "featured": false,
  "createdAt": "2026-09-21T12:00:00Z",
  "updatedAt": "2026-09-21T12:00:00Z",
  "provenance": "Imported from EtsyListingsDownload.csv for Storefront V1; CSV does not include reliable Etsy listing IDs or product URLs."
}
