{
  "schemaVersion": 1,
  "id": "prod-do-hal-0004",
  "sku": "DO-HAL-0004",
  "title": "Whimsical Skeleton Halloween Coaster Bundle, Graveyard Designs (Digital Download)",
  "slug": "whimsical-skeleton-halloween-coaster-bundle-graveyard-designs-digital-download",
  "description": "A playful skeleton quartet for lighthearted Halloween decor: a top-hatted skeleton at the piano surrounded by candlelight, a fishing skeleton \"still fishing for a better afterlife,\" a skeletal horse-drawn hearse rolling through the graveyard mist, and a classic moonlit cemetery scene watched over by a lone crow.\n\n✦ WHAT YOU GET\n• 4 separate high-resolution PNG files (2400 x 2400 px, 300 DPI)\n• Ready for sublimation coasters, UV DTF printing, tumblers, and more\n• Instant digital download — no physical item is shipped\n\n✦ DESIGN NOTES\nA wink of dark humor runs through this set, pairing whimsical skeleton characters with classic graveyard atmosphere.\n\n✦ AI DISCLOSURE\nThese designs were created with the assistance of AI image-generation tools as part of my creative process, then hand-curated, cleaned up, and prepared for print. This listing is a digital file only; no physical product is shipped.\n\n✦ USAGE\nFor personal use and small-batch commercial use on physical items you make and sell (coasters, tumblers, apparel, etc.). Resale or redistribution of the digital files themselves is not permitted.\n\nThank you for shopping Dragon Oak Studio!",
  "collection": "halloween",
  "subcollection": "coaster-bundles",
  "productType": "digital_download",
  "tags": [
    "funny_skeleton_png",
    "skeleton_piano_art",
    "skeleton_fishing",
    "hearse_graveyard",
    "cemetery_crow_png",
    "coaster_sublimation",
    "uv_printer_file",
    "halloween_coaster",
    "spooky_clipart",
    "dark_humor_art",
    "digital_download",
    "png_bundle",
    "instant_download"
  ],
  "price": {
    "amountCents": 399,
    "currency": "USD"
  },
  "images": [
    {
      "path": "https://i.etsystatic.com/64473522/r/il/b39389/8593002473/il_fullxfull.8593002473_6973.jpg",
      "alt": "Whimsical Skeleton Halloween Coaster Bundle, Graveyard Designs (Digital Download)"
    },
    {
      "path": "https://i.etsystatic.com/64473522/r/il/75ed9c/8545135154/il_fullxfull.8545135154_7p0q.jpg",
      "alt": "Whimsical Skeleton Halloween Coaster Bundle, Graveyard Designs (Digital Download)"
    },
    {
      "path": "https://i.etsystatic.com/64473522/r/il/f4383e/8545135134/il_fullxfull.8545135134_jdvp.jpg",
      "alt": "Whimsical Skeleton Halloween Coaster Bundle, Graveyard Designs (Digital Download)"
    },
    {
      "path": "https://i.etsystatic.com/64473522/r/il/92b3dc/8593002519/il_fullxfull.8593002519_f0ve.jpg",
      "alt": "Whimsical Skeleton Halloween Coaster Bundle, Graveyard Designs (Digital Download)"
    },
    {
      "path": "https://i.etsystatic.com/64473522/r/il/2fa8ca/8593002533/il_fullxfull.8593002533_2ckx.jpg",
      "alt": "Whimsical Skeleton Halloween Coaster Bundle, Graveyard Designs (Digital Download)"
    }
  ],
  "digitalFiles": [],
  "etsy": {
    "listingId": null,
    "url": null,
    "state": "not_listed",
    "syncedAt": null
  },
  "siteState": "published",
  "featured": false,
  "createdAt": "2026-09-21T12:00:00Z",
  "updatedAt": "2026-09-21T12:00:00Z",
  "provenance": "Imported from EtsyListingsDownload.csv for Storefront V1; CSV does not include reliable Etsy listing IDs or product URLs."
}
