{
  "schemaVersion": 1,
  "id": "prod-do-hal-0007",
  "sku": "DO-HAL-0007",
  "title": "Witchcraft Coaster PNG Bundle, Halloween Potion & Tarot Designs (Digital Download)",
  "slug": "witchcraft-coaster-png-bundle-halloween-potion-and-tarot-designs-digital-downloa",
  "description": "A spellbinding quartet for the witchy crowd: a shelf of glowing potion bottles with a sleepy black cat, three witches gathered around a bubbling cauldron, a lone witch silhouette flying her broom across a giant harvest moon, and a candlelit tarot table with a swirling crystal ball.\n\n✦ WHAT YOU GET\n• 4 separate high-resolution PNG files (2400 x 2400 px, 300 DPI)\n• Ready for sublimation coasters, UV DTF printing, tumblers, and more\n• Instant digital download — no physical item is shipped\n\n✦ DESIGN NOTES\nPurples, greens, and candlelight tie together potions, tarot, and broomstick flight into one cohesive witchcraft-themed set.\n\n✦ AI DISCLOSURE\nThese designs were created with the assistance of AI image-generation tools as part of my creative process, then hand-curated, cleaned up, and prepared for print. This listing is a digital file only; no physical product is shipped.\n\n✦ USAGE\nFor personal use and small-batch commercial use on physical items you make and sell (coasters, tumblers, apparel, etc.). Resale or redistribution of the digital files themselves is not permitted.\n\nThank you for shopping Dragon Oak Studio!",
  "collection": "halloween",
  "subcollection": "coaster-bundles",
  "productType": "digital_download",
  "tags": [
    "witch_coaster_png",
    "witch_potion_art",
    "tarot_card_png",
    "cauldron_witches",
    "flying_witch_png",
    "coaster_sublimation",
    "uv_printer_file",
    "halloween_coaster",
    "spooky_clipart",
    "crystal_ball_art",
    "digital_download",
    "png_bundle",
    "instant_download"
  ],
  "price": {
    "amountCents": 399,
    "currency": "USD"
  },
  "images": [
    {
      "path": "https://i.etsystatic.com/64473522/r/il/8f5405/8592955895/il_fullxfull.8592955895_8xxt.jpg",
      "alt": "Witchcraft Coaster PNG Bundle, Halloween Potion & Tarot Designs (Digital Download)"
    },
    {
      "path": "https://i.etsystatic.com/64473522/r/il/71e282/8545089384/il_fullxfull.8545089384_cwpa.jpg",
      "alt": "Witchcraft Coaster PNG Bundle, Halloween Potion & Tarot Designs (Digital Download)"
    },
    {
      "path": "https://i.etsystatic.com/64473522/r/il/d46657/8592955937/il_fullxfull.8592955937_2uwa.jpg",
      "alt": "Witchcraft Coaster PNG Bundle, Halloween Potion & Tarot Designs (Digital Download)"
    },
    {
      "path": "https://i.etsystatic.com/64473522/r/il/f1d09e/8545089390/il_fullxfull.8545089390_gj3t.jpg",
      "alt": "Witchcraft Coaster PNG Bundle, Halloween Potion & Tarot Designs (Digital Download)"
    },
    {
      "path": "https://i.etsystatic.com/64473522/r/il/f0906c/8545089388/il_fullxfull.8545089388_cfan.jpg",
      "alt": "Witchcraft Coaster PNG Bundle, Halloween Potion & Tarot Designs (Digital Download)"
    }
  ],
  "digitalFiles": [],
  "etsy": {
    "listingId": null,
    "url": null,
    "state": "not_listed",
    "syncedAt": null
  },
  "siteState": "published",
  "featured": false,
  "createdAt": "2026-09-21T12:00:00Z",
  "updatedAt": "2026-09-21T12:00:00Z",
  "provenance": "Imported from EtsyListingsDownload.csv for Storefront V1; CSV does not include reliable Etsy listing IDs or product URLs."
}
