{
  "schemaVersion": 1,
  "id": "prod-do-hal-0016",
  "sku": "DO-HAL-0016",
  "title": "Haunted Manor & Monsters Coaster PNG Bundle, Set of 4 Frankenstein Swamp Designs, Halloween Digital Download UV Print Files",
  "slug": "haunted-manor-and-monsters-coaster-png-bundle-set-of-4-frankenstein-swamp-design",
  "description": "A classic-monster quartet for horror collectors: a skeletal hayride wagon rolling past the pumpkin patch, a grand haunted Victorian mansion glowing above its own gated cemetery, an eerie glowing swamp watched over by a lone heron and a forgotten skull, and a mad scientist's lab crackling to life around Frankenstein's monster.\n\n✦ WHAT YOU GET\n• 4 separate high-resolution PNG files (2400 x 2400 px, 300 DPI)\n• Ready for sublimation coasters, UV DTF printing, tumblers, and more\n• Instant digital download — no physical item is shipped\n\n✦ DESIGN NOTES\nThis set brings together four classic haunted-house and monster-movie staples into one cohesive collection.\n\n✦ AI DISCLOSURE\nThese designs were created with the assistance of AI image-generation tools as part of my creative process, then hand-curated, cleaned up, and prepared for print. This listing is a digital file only; no physical product is shipped.\n\n✦ USAGE\nFor personal use and small-batch commercial use on physical items you make and sell (coasters, tumblers, apparel, etc.). Resale or redistribution of the digital files themselves is not permitted.\n\nThank you for shopping Dragon Oak Studio!",
  "collection": "halloween",
  "subcollection": "coaster-bundles",
  "productType": "digital_download",
  "tags": [
    "haunted_mansion_png",
    "frankenstein_art",
    "haunted_hayride",
    "glowing_swamp_png",
    "mad_scientist_art",
    "coaster_sublimation",
    "uv_printer_file",
    "halloween_coaster",
    "spooky_clipart",
    "monster_horror_art",
    "digital_download",
    "png_bundle",
    "instant_download"
  ],
  "price": {
    "amountCents": 399,
    "currency": "USD"
  },
  "images": [
    {
      "path": "https://i.etsystatic.com/64473522/r/il/60b9ba/8593037817/il_fullxfull.8593037817_6oa9.jpg",
      "alt": "Haunted Manor & Monsters Coaster PNG Bundle, Set of 4 Frankenstein Swamp Designs, Halloween Digital Download UV Print Files"
    },
    {
      "path": "https://i.etsystatic.com/64473522/r/il/bdbd12/8593037899/il_fullxfull.8593037899_dsvj.jpg",
      "alt": "Haunted Manor & Monsters Coaster PNG Bundle, Set of 4 Frankenstein Swamp Designs, Halloween Digital Download UV Print Files"
    },
    {
      "path": "https://i.etsystatic.com/64473522/r/il/20c883/8545170378/il_fullxfull.8545170378_5ts2.jpg",
      "alt": "Haunted Manor & Monsters Coaster PNG Bundle, Set of 4 Frankenstein Swamp Designs, Halloween Digital Download UV Print Files"
    },
    {
      "path": "https://i.etsystatic.com/64473522/r/il/d551ee/8545170376/il_fullxfull.8545170376_ls1x.jpg",
      "alt": "Haunted Manor & Monsters Coaster PNG Bundle, Set of 4 Frankenstein Swamp Designs, Halloween Digital Download UV Print Files"
    },
    {
      "path": "https://i.etsystatic.com/64473522/r/il/c3a2a5/8593037905/il_fullxfull.8593037905_t36w.jpg",
      "alt": "Haunted Manor & Monsters Coaster PNG Bundle, Set of 4 Frankenstein Swamp Designs, Halloween Digital Download UV Print Files"
    }
  ],
  "digitalFiles": [],
  "etsy": {
    "listingId": null,
    "url": null,
    "state": "not_listed",
    "syncedAt": null
  },
  "siteState": "published",
  "featured": false,
  "createdAt": "2026-09-21T12:00:00Z",
  "updatedAt": "2026-09-21T12:00:00Z",
  "provenance": "Imported from EtsyListingsDownload.csv for Storefront V1; CSV does not include reliable Etsy listing IDs or product URLs."
}
