{
  "schemaVersion": 1,
  "id": "prod-do-bkm-0003",
  "sku": "DO-BKM-0003",
  "title": "Wine Girl Magnetic Bookmark Printable Bundle Vol. 3, 5 Designs, 2x6 Inch PNG, Wine Lover Gift, Digital Download",
  "slug": "wine-girl-magnetic-bookmark-printable-bundle-vol-3-5-designs-2x6-inch-png-wine-l",
  "description": "A set of 5 wine-lover magnetic bookmark designs, ready to print at home or at a print shop: stylish women enjoying a glass of wine, each with a wine-themed journaling quote on the back panel. Print, cut, fold, and add magnets for a pretty bookmark, wine journal accessory, or gift.\n\n✦ WHAT YOU GET\n• 5 separate PNG files (Designs 11–15 of the 20-design Virgie Wine Bookmark collection)\n• Each file: 1200 x 3600 px, 600 PPI, 2 x 6 inches flat / 2 x 3 inches folded\n• Instant digital download, no physical item shipped\n\n✦ THE 5 DESIGNS\n1. Design 11 — burgundy glitter, woman in a coral off-shoulder blouse with white wine\n2. Design 12 — purple sunset sky, red-haired woman in a black turtleneck with a glass of white wine\n3. Design 13 — deep green backdrop with soft leaf shadows, woman in a green satin wrap blouse\n4. Design 14 — city skyline at dusk, woman in a maroon high-collar top sipping red wine\n5. Design 15 — bold tropical hibiscus florals, woman in a white halter top with a glass of wine\n\n✦ HOW TO USE\n• Print at 100% / Actual Size (do not use \"Fit to Page\")\n• Each bookmark prints flat at 2 x 6 inches and folds to 2 x 3 inches at the center bridge\n• Cut around the bookmark outline, fold at the center, and add small magnets to the inside ends to make a magnetic bookmark (magnets, paper, and printer are not included)\n• The upside-down quote on the back panel is intentional; it reads correctly once the bookmark is folded\n\n✦ FILE DETAILS\n• Format: PNG, RGB (sRGB color)\n• Size: 1200 x 3600 px per design (2 x 6 inches at 600 PPI)\n• The artwork is supplied on a solid black background outside the bookmark outline (no transparent background) — cut along the bookmark edge\n• Original artwork files; the ZIP packaging (if any) does not compress or change the images\n\n✦ INSTANT DIGITAL DOWNLOAD\nYour files are available to download from Etsy immediately after payment is confirmed. This is a DIGITAL PRODUCT: no physical bookmark, magnets, or printed item will be shipped, and nothing is sent to you manually.\n\n✦ AI DISCLOSURE\nThese designs were created with the assistance of AI image-generation tools as part of my creative process, then hand-curated, cleaned up, and prepared for print.\n\n✦ USAGE\nFor personal use and small-batch commercial use on physical items you make and sell. Resale or redistribution of the digital files themselves is not permitted.\n\n✦ PLEASE NOTE\nPrinted colors can vary by monitor, printer, ink, and paper. Preview images carry a watermark; the files you download do not.\n\nThank you for shopping Dragon Oak Studio!",
  "collection": "cute-bookmarks",
  "subcollection": "wine-magnetic-bookmarks",
  "productType": "digital_download",
  "tags": [
    "magnetic_bookmark",
    "printable_bookmark",
    "bookmark_png",
    "wine_bookmark",
    "wine_lover_gift",
    "wine_journal",
    "wine_girl_art",
    "digital_download",
    "instant_download",
    "bookmark_bundle",
    "diy_bookmark",
    "book_lover_gift",
    "tropical_floral_art"
  ],
  "price": {
    "amountCents": 499,
    "currency": "USD"
  },
  "images": [
    {
      "path": "https://i.etsystatic.com/64473522/r/il/91a1e8/8597715979/il_fullxfull.8597715979_cviz.jpg",
      "alt": "Wine Girl Magnetic Bookmark Printable Bundle Vol. 3, 5 Designs, 2x6 Inch PNG, Wine Lover Gift, Digital Download"
    },
    {
      "path": "https://i.etsystatic.com/64473522/r/il/2c0477/8549841626/il_fullxfull.8549841626_gh9m.jpg",
      "alt": "Wine Girl Magnetic Bookmark Printable Bundle Vol. 3, 5 Designs, 2x6 Inch PNG, Wine Lover Gift, Digital Download"
    },
    {
      "path": "https://i.etsystatic.com/64473522/r/il/b14d2c/8597716103/il_fullxfull.8597716103_q78t.jpg",
      "alt": "Wine Girl Magnetic Bookmark Printable Bundle Vol. 3, 5 Designs, 2x6 Inch PNG, Wine Lover Gift, Digital Download"
    },
    {
      "path": "https://i.etsystatic.com/64473522/r/il/697899/8597716145/il_fullxfull.8597716145_mu5u.jpg",
      "alt": "Wine Girl Magnetic Bookmark Printable Bundle Vol. 3, 5 Designs, 2x6 Inch PNG, Wine Lover Gift, Digital Download"
    },
    {
      "path": "https://i.etsystatic.com/64473522/r/il/561a6c/8597716203/il_fullxfull.8597716203_62pq.jpg",
      "alt": "Wine Girl Magnetic Bookmark Printable Bundle Vol. 3, 5 Designs, 2x6 Inch PNG, Wine Lover Gift, Digital Download"
    },
    {
      "path": "https://i.etsystatic.com/64473522/r/il/e8c858/8597716285/il_fullxfull.8597716285_5ra9.jpg",
      "alt": "Wine Girl Magnetic Bookmark Printable Bundle Vol. 3, 5 Designs, 2x6 Inch PNG, Wine Lover Gift, Digital Download"
    }
  ],
  "digitalFiles": [],
  "etsy": {
    "listingId": null,
    "url": null,
    "state": "not_listed",
    "syncedAt": null
  },
  "siteState": "published",
  "featured": false,
  "createdAt": "2026-09-21T12:00:00Z",
  "updatedAt": "2026-09-21T12:00:00Z",
  "provenance": "Imported from EtsyListingsDownload.csv for Storefront V1; CSV does not include reliable Etsy listing IDs or product URLs."
}
