{
  "schemaVersion": 1,
  "id": "prod-do-hal-0006",
  "sku": "DO-HAL-0006",
  "title": "Blood Moon Halloween Coaster PNG Bundle, Set of 4 Horror Night Designs, Vampire Scarecrow Owl, Digital Download UV Print Files",
  "slug": "blood-moon-halloween-coaster-png-bundle-set-of-4-horror-night-designs-vampire-sc",
  "description": "A blood-red quartet built around a rising crimson moon: a great horned owl watching over misty woods, a vampire's clawed hand emerging from an open coffin, a field of scarecrows standing guard under the red sky, and an abandoned, fog-wrapped fairground with a haunted Ferris wheel.\n\n✦ WHAT YOU GET\n• 4 separate high-resolution PNG files (2400 x 2400 px, 300 DPI)\n• Ready for sublimation coasters, UV DTF printing, tumblers, and more\n• Instant digital download — no physical item is shipped\n\n✦ DESIGN NOTES\nThe shared blood-moon sky unifies four very different horror scenes into one striking, high-contrast collection.\n\n✦ AI DISCLOSURE\nThese designs were created with the assistance of AI image-generation tools as part of my creative process, then hand-curated, cleaned up, and prepared for print. This listing is a digital file only; no physical product is shipped.\n\n✦ USAGE\nFor personal use and small-batch commercial use on physical items you make and sell (coasters, tumblers, apparel, etc.). Resale or redistribution of the digital files themselves is not permitted.\n\nThank you for shopping Dragon Oak Studio!",
  "collection": "halloween",
  "subcollection": "coaster-bundles",
  "productType": "digital_download",
  "tags": [
    "blood_moon_png",
    "vampire_coffin_art",
    "scarecrow_horror",
    "haunted_fairground",
    "horned_owl_png",
    "coaster_sublimation",
    "uv_printer_file",
    "halloween_coaster",
    "spooky_clipart",
    "horror_night_art",
    "digital_download",
    "png_bundle",
    "instant_download"
  ],
  "price": {
    "amountCents": 399,
    "currency": "USD"
  },
  "images": [
    {
      "path": "https://i.etsystatic.com/64473522/r/il/a143d7/8592982781/il_fullxfull.8592982781_7k1t.jpg",
      "alt": "Blood Moon Halloween Coaster PNG Bundle, Set of 4 Horror Night Designs, Vampire Scarecrow Owl, Digital Download UV Print Files"
    },
    {
      "path": "https://i.etsystatic.com/64473522/r/il/07baa0/8592982843/il_fullxfull.8592982843_czly.jpg",
      "alt": "Blood Moon Halloween Coaster PNG Bundle, Set of 4 Horror Night Designs, Vampire Scarecrow Owl, Digital Download UV Print Files"
    },
    {
      "path": "https://i.etsystatic.com/64473522/r/il/a1a0f8/8592982853/il_fullxfull.8592982853_ff3j.jpg",
      "alt": "Blood Moon Halloween Coaster PNG Bundle, Set of 4 Horror Night Designs, Vampire Scarecrow Owl, Digital Download UV Print Files"
    },
    {
      "path": "https://i.etsystatic.com/64473522/r/il/166ad3/8545115838/il_fullxfull.8545115838_9p2e.jpg",
      "alt": "Blood Moon Halloween Coaster PNG Bundle, Set of 4 Horror Night Designs, Vampire Scarecrow Owl, Digital Download UV Print Files"
    },
    {
      "path": "https://i.etsystatic.com/64473522/r/il/f197aa/8592982855/il_fullxfull.8592982855_76po.jpg",
      "alt": "Blood Moon Halloween Coaster PNG Bundle, Set of 4 Horror Night Designs, Vampire Scarecrow Owl, Digital Download UV Print Files"
    }
  ],
  "digitalFiles": [],
  "etsy": {
    "listingId": null,
    "url": null,
    "state": "not_listed",
    "syncedAt": null
  },
  "siteState": "published",
  "featured": false,
  "createdAt": "2026-09-21T12:00:00Z",
  "updatedAt": "2026-09-21T12:00:00Z",
  "provenance": "Imported from EtsyListingsDownload.csv for Storefront V1; CSV does not include reliable Etsy listing IDs or product URLs."
}
