{
  "schemaVersion": 1,
  "id": "prod-do-hal-0010",
  "sku": "DO-HAL-0010",
  "title": "Gothic Castle Skeleton Knight Coaster Bundle, Dark Fantasy Cemetery Designs (Digital Download)",
  "slug": "gothic-castle-skeleton-knight-coaster-bundle-dark-fantasy-cemetery-designs-digit",
  "description": "A dark-fantasy quartet built around a towering gothic castle and its undead guardian: a moonlit stone mausoleum draped in ivy, a mountaintop castle glowing above a waterfall with bats overhead, and two views of an armored skeleton knight standing watch at a crypt door and inside a candlelit cathedral hall.\n\n✦ WHAT YOU GET\n• 4 separate high-resolution PNG files (2400 x 2400 px, 300 DPI)\n• Ready for sublimation coasters, UV DTF printing, tumblers, and more\n• Instant digital download — no physical item is shipped\n\n✦ DESIGN NOTES\nRich armor detail, candlelight, and gothic architecture give this set a storybook dark-fantasy feel that pairs naturally as a four-piece collection.\n\n✦ AI DISCLOSURE\nThese designs were created with the assistance of AI image-generation tools as part of my creative process, then hand-curated, cleaned up, and prepared for print. This listing is a digital file only; no physical product is shipped.\n\n✦ USAGE\nFor personal use and small-batch commercial use on physical items you make and sell (coasters, tumblers, apparel, etc.). Resale or redistribution of the digital files themselves is not permitted.\n\nThank you for shopping Dragon Oak Studio!",
  "collection": "halloween",
  "subcollection": "coaster-bundles",
  "productType": "digital_download",
  "tags": [
    "gothic_castle_png",
    "skeleton_knight",
    "dark_fantasy_art",
    "crypt_cemetery",
    "halloween_castle",
    "coaster_sublimation",
    "uv_printer_file",
    "halloween_coaster",
    "spooky_clipart",
    "medieval_gothic",
    "digital_download",
    "png_bundle",
    "instant_download"
  ],
  "price": {
    "amountCents": 399,
    "currency": "USD"
  },
  "images": [
    {
      "path": "https://i.etsystatic.com/64473522/r/il/ffebd2/8545077494/il_fullxfull.8545077494_djpb.jpg",
      "alt": "Gothic Castle Skeleton Knight Coaster Bundle, Dark Fantasy Cemetery Designs (Digital Download)"
    },
    {
      "path": "https://i.etsystatic.com/64473522/r/il/e77279/8545077576/il_fullxfull.8545077576_5u56.jpg",
      "alt": "Gothic Castle Skeleton Knight Coaster Bundle, Dark Fantasy Cemetery Designs (Digital Download)"
    },
    {
      "path": "https://i.etsystatic.com/64473522/r/il/b1322c/8592943865/il_fullxfull.8592943865_drth.jpg",
      "alt": "Gothic Castle Skeleton Knight Coaster Bundle, Dark Fantasy Cemetery Designs (Digital Download)"
    },
    {
      "path": "https://i.etsystatic.com/64473522/r/il/023cfe/8545077586/il_fullxfull.8545077586_1330.jpg",
      "alt": "Gothic Castle Skeleton Knight Coaster Bundle, Dark Fantasy Cemetery Designs (Digital Download)"
    },
    {
      "path": "https://i.etsystatic.com/64473522/r/il/384d2f/8545077584/il_fullxfull.8545077584_avye.jpg",
      "alt": "Gothic Castle Skeleton Knight Coaster Bundle, Dark Fantasy Cemetery Designs (Digital Download)"
    }
  ],
  "digitalFiles": [],
  "etsy": {
    "listingId": null,
    "url": null,
    "state": "not_listed",
    "syncedAt": null
  },
  "siteState": "published",
  "featured": false,
  "createdAt": "2026-09-21T12:00:00Z",
  "updatedAt": "2026-09-21T12:00:00Z",
  "provenance": "Imported from EtsyListingsDownload.csv for Storefront V1; CSV does not include reliable Etsy listing IDs or product URLs."
}
