{
  "schemaVersion": 1,
  "id": "prod-do-hal-0003",
  "sku": "DO-HAL-0003",
  "title": "Chibi Halloween Coaster PNG Bundle, Set of 4 Cute Kawaii Girl Designs, Digital Download UV Print Files",
  "slug": "chibi-halloween-coaster-png-bundle-set-of-4-cute-kawaii-girl-designs-digital-dow",
  "description": "An adorable chibi quartet for Halloween lovers: a giggling redhead mummy girl unwrapping her bandages beside an ancient Egyptian temple, a sweet ghost-costume girl waving hello between two ghost friends and glowing jack-o'-lanterns, a gothic vampire girl in a red-and-black gown holding a heart lollipop outside a candlelit castle, and a freckle-faced scarecrow girl in patchwork overalls with a crow on her shoulder in a golden cornfield.\n\n✦ WHAT YOU GET\n• 4 separate high-resolution PNG files (1254 x 1254 px)\n• Ready for sublimation coasters, UV DTF printing, tumblers, and more\n• Instant digital download — no physical item is shipped\n\n✦ DESIGN NOTES\nKawaii chibi-style art with big sparkling eyes and warm autumn lighting give this set a cute, collectible feel that's a little different from our gothic-horror collections — perfect for anyone who wants their Halloween sweet instead of spooky.\n\n✦ AI DISCLOSURE\nThese designs were created with the assistance of AI image-generation tools as part of my creative process, then hand-curated, cleaned up, and prepared for print. This listing is a digital file only; no physical product is shipped.\n\n✦ USAGE\nFor personal use and small-batch commercial use on physical items you make and sell (coasters, tumblers, apparel, etc.). Resale or redistribution of the digital files themselves is not permitted.\n\nThank you for shopping Dragon Oak Studio!",
  "collection": "halloween",
  "subcollection": "coaster-bundles",
  "productType": "digital_download",
  "tags": [
    "chibi_halloween_png",
    "kawaii_halloween_art",
    "mummy_girl_png",
    "cute_ghost_art",
    "chibi_vampire_girl",
    "scarecrow_girl_png",
    "coaster_sublimation",
    "uv_printer_file",
    "halloween_coaster",
    "anime_halloween_art",
    "digital_download",
    "png_bundle",
    "instant_download"
  ],
  "price": {
    "amountCents": 399,
    "currency": "USD"
  },
  "images": [
    {
      "path": "https://i.etsystatic.com/64473522/r/il/526903/8547199126/il_fullxfull.8547199126_9tpp.jpg",
      "alt": "Chibi Halloween Coaster PNG Bundle, Set of 4 Cute Kawaii Girl Designs, Digital Download UV Print Files"
    },
    {
      "path": "https://i.etsystatic.com/64473522/r/il/f9fa5b/8547199116/il_fullxfull.8547199116_fk2r.jpg",
      "alt": "Chibi Halloween Coaster PNG Bundle, Set of 4 Cute Kawaii Girl Designs, Digital Download UV Print Files"
    },
    {
      "path": "https://i.etsystatic.com/64473522/r/il/5f6634/8595067567/il_fullxfull.8595067567_js1q.jpg",
      "alt": "Chibi Halloween Coaster PNG Bundle, Set of 4 Cute Kawaii Girl Designs, Digital Download UV Print Files"
    },
    {
      "path": "https://i.etsystatic.com/64473522/r/il/cd5bcf/8595067587/il_fullxfull.8595067587_et17.jpg",
      "alt": "Chibi Halloween Coaster PNG Bundle, Set of 4 Cute Kawaii Girl Designs, Digital Download UV Print Files"
    },
    {
      "path": "https://i.etsystatic.com/64473522/r/il/22eb6a/8595067581/il_fullxfull.8595067581_ksyi.jpg",
      "alt": "Chibi Halloween Coaster PNG Bundle, Set of 4 Cute Kawaii Girl Designs, Digital Download UV Print Files"
    }
  ],
  "digitalFiles": [],
  "etsy": {
    "listingId": null,
    "url": null,
    "state": "not_listed",
    "syncedAt": null
  },
  "siteState": "published",
  "featured": false,
  "createdAt": "2026-09-21T12:00:00Z",
  "updatedAt": "2026-09-21T12:00:00Z",
  "provenance": "Imported from EtsyListingsDownload.csv for Storefront V1; CSV does not include reliable Etsy listing IDs or product URLs."
}
